{
  "$schema": "https://json-schema.org/draft/2020-12/schema",
  "$id": "svs:receipt:v0.1",
  "type": "object",
  "required": [
    "receipt_version",
    "receipt_id",
    "issued_at",
    "nonce",
    "actor",
    "agent",
    "intent",
    "policy",
    "tool",
    "action",
    "context_digest",
    "decision",
    "signature"
  ],
  "properties": {
    "receipt_version": {
      "const": "0.1"
    },
    "receipt_id": {
      "type": "string",
      "minLength": 8
    },
    "issued_at": {
      "type": "string",
      "minLength": 10
    },
    "nonce": {
      "type": "string",
      "minLength": 8
    },
    "actor": {
      "type": "object",
      "required": [
        "type",
        "id"
      ],
      "properties": {
        "type": {
          "type": "string"
        },
        "id": {
          "type": "string"
        }
      },
      "additionalProperties": true
    },
    "agent": {
      "type": "object",
      "required": [
        "name",
        "version"
      ],
      "properties": {
        "name": {
          "type": "string"
        },
        "version": {
          "type": "string"
        },
        "model": {
          "type": "string"
        }
      },
      "additionalProperties": true
    },
    "intent": {
      "type": "object",
      "required": [
        "intent_id"
      ],
      "properties": {
        "intent_id": {
          "type": "string"
        },
        "scope": {
          "type": "string"
        }
      },
      "additionalProperties": true
    },
    "policy": {
      "type": "object",
      "required": [
        "policy_id",
        "policy_version"
      ],
      "properties": {
        "policy_id": {
          "type": "string"
        },
        "policy_version": {
          "type": "string"
        }
      },
      "additionalProperties": true
    },
    "tool": {
      "type": "object",
      "required": [
        "name",
        "action_type"
      ],
      "properties": {
        "name": {
          "type": "string"
        },
        "action_type": {
          "type": "string"
        }
      },
      "additionalProperties": true
    },
    "action": {
      "type": "object",
      "required": [
        "action_id",
        "params_digest"
      ],
      "properties": {
        "action_id": {
          "type": "string"
        },
        "params_digest": {
          "type": "string"
        }
      },
      "additionalProperties": true
    },
    "context_digest": {
      "type": "string",
      "minLength": 8
    },
    "output_digest": {
      "type": "string"
    },
    "decision": {
      "type": "object",
      "required": [
        "effect",
        "reason_code"
      ],
      "properties": {
        "effect": {
          "enum": [
            "ALLOW",
            "DENY",
            "DEGRADE"
          ]
        },
        "reason_code": {
          "type": "string",
          "enum": [
            "SVS_CERT_EXPIRED",
            "SVS_CERT_INVALID_SIGNATURE",
            "SVS_CERT_MISSING_CERT",
            "SVS_CERT_MISSING_SUBJECT_PK",
            "SVS_CERT_WRONG_ISSUER",
            "SVS_DEGRADE_PREVIEW_ONLY",
            "SVS_EFFECT_UNKNOWN",
            "SVS_GATE_MISSING_RECEIPT",
            "SVS_GATE_RECEIPT_B64_PARSE_ERROR",
            "SVS_GATE_RECEIPT_PARSE_ERROR",
            "SVS_POLICY_ALLOW",
            "SVS_POLICY_NEEDS_HUMAN_CONFIRM",
            "SVS_POLICY_VIOLATION",
            "SVS_REPLAY_DETECTED",
            "SVS_SIG_INVALID_SIGNATURE",
            "SVS_SIG_MISSING_RECEIPT_SIG",
            "SVS_SIG_UNSUPPORTED_ALG",
            "SVS_TIME_EXPIRED_RECEIPT",
            "SVS_TIME_RECEIPT_TIME_PARSE_ERROR"
          ]
        },
        "constraints": {
          "type": "object"
        }
      },
      "additionalProperties": true
    },
    "evidence_refs": {
      "type": "array",
      "items": {
        "type": "object",
        "required": [
          "evidence_type",
          "digest"
        ],
        "properties": {
          "evidence_type": {
            "type": "string"
          },
          "digest": {
            "type": "string"
          },
          "uri": {
            "type": "string"
          }
        },
        "additionalProperties": true
      }
    },
    "signature": {
      "type": "object",
      "required": [
        "alg",
        "kid",
        "sig"
      ],
      "properties": {
        "alg": {
          "const": "Ed25519"
        },
        "kid": {
          "type": "string"
        },
        "sig": {
          "type": "string",
          "minLength": 16
        },
        "cert": {
          "type": "object"
        }
      },
      "additionalProperties": false
    }
  },
  "additionalProperties": true
}
