{
  "receipt_version": "0.1",
  "receipt_id": "r-allow-001",
  "issued_at": "2026-02-22T11:49:24Z",
  "nonce": "n-abc12345",
  "actor": {
    "type": "user",
    "id": "u-001"
  },
  "agent": {
    "name": "agent-x",
    "version": "0.1",
    "model": "gpt-like"
  },
  "intent": {
    "intent_id": "i-001",
    "scope": "publish_post"
  },
  "policy": {
    "policy_id": "p-001",
    "policy_version": "0.1"
  },
  "tool": {
    "name": "content_api",
    "action_type": "publish"
  },
  "action": {
    "action_id": "a-001",
    "params_digest": "sha256:params"
  },
  "context_digest": "sha256:context",
  "output_digest": "sha256:output",
  "decision": {
    "effect": "ALLOW",
    "reason_code": "SVS_POLICY_ALLOW"
  },
  "signature": {
    "alg": "Ed25519",
    "kid": "impl-kid-001",
    "sig": "gStke18GzRVphve0AFHbvwd7fjVVj24VIMmAiJofrO6XdYyj0q2fWL5vP+a5u4jRoaU8NInBwzHhWDixK2UjAg=="
  }
}