{
  "receipt_version": "0.1",
  "receipt_id": "r-deny-001",
  "issued_at": "2026-02-22T11:11:25Z",
  "nonce": "n-deny1234",
  "actor": { "type": "user", "id": "u-001" },
  "agent": { "name": "agent-x", "version": "0.1" },
  "intent": { "intent_id": "i-001", "scope": "publish_post" },
  "policy": { "policy_id": "p-001", "policy_version": "0.1" },
  "tool": { "name": "content_api", "action_type": "publish" },
  "action": { "action_id": "a-002", "params_digest": "sha256:params2" },
  "context_digest": "sha256:context2",
  "decision": { "effect": "DENY", "reason_code": "SVS_POLICY_VIOLATION" },
  "signature": { "alg": "Ed25519", "kid": "k-001", "sig": "BASE64_SIGNATURE_PLACEHOLDER" }
}
