{
  "receipt_version": "0.1",
  "receipt_id": "r-degrade-001",
  "issued_at": "2026-02-22T11:56:24Z",
  "nonce": "n-deg12345",
  "actor": {
    "type": "user",
    "id": "u-001"
  },
  "agent": {
    "name": "agent-x",
    "version": "0.1"
  },
  "intent": {
    "intent_id": "i-001",
    "scope": "publish_post"
  },
  "policy": {
    "policy_id": "p-001",
    "policy_version": "0.1"
  },
  "tool": {
    "name": "content_api",
    "action_type": "publish"
  },
  "action": {
    "action_id": "a-003",
    "params_digest": "sha256:params3"
  },
  "context_digest": "sha256:context3",
  "output_digest": "sha256:output3",
  "decision": {
    "effect": "DEGRADE",
    "reason_code": "SVS_POLICY_NEEDS_HUMAN_CONFIRM",
    "constraints": {
      "requires_human_confirm": true
    }
  },
  "signature": {
    "alg": "Ed25519",
    "kid": "impl-kid-001",
    "sig": "5eYP2d+cRk6Exg0v6v0tVoohm7vdUIbL+hACNFn3byi7jW6I9J7TikHDXhYGC1t8g1b39amvbnfOEc6JPMgIDw==",
    "cert": {
      "cert_version": "0.1",
      "cert_id": "c-e75c3c83-8595-4391-bf96-32169707f386",
      "subject_kid": "impl-kid-001",
      "subject_public_key_b64": "Kx1VchCygMzoWM0eoDU8X/ojiw/RAsj3yVjfr6OtGzw=",
      "issuer_kid": "svs-root-kid-001",
      "issued_at": "2026-02-22T11:10:26Z",
      "expires_at": "2027-02-22T11:10:26Z",
      "sig_b64": "Kzpqkhbp8XfNCKkC8nW1ReykAqltH32lcujnKf5utVgStZFE6b+vPD/FbJX2fWYydTyQrqtIVgM/svWTFW88Aw=="
    }
  }
}